{
  "job_id": "phase2a-fwq000700000000000000000",
  "reviewed_commit": "dd51951b628886c13e07ff8cddccf170da99d6e4",
  "verdict": "APPROVE",
  "risk": "LOW",
  "blocking_findings": [],
  "non_blocking_notes": [],
  "tests_missing": [],
  "reasoning_summary": "The change successfully adds a read-only deterministic policy gate requiring DRY_RUN mode, disabled deployment, and an engaged kill switch for activation. Status reporting safely reports CLEARED_FOR_DRY_RUN without authorization. The gate is integrated into safety_status and validate_activation with focused tests covering safe, malformed, missing, and unsafe evidence. No security boundaries, credentials, remote hosts, or authority expansions were introduced.",
  "proposed_rules": []
}
