{
  "job_id": "phase2a-514217e474e46872c12efdad",
  "reviewed_commit": "514217e474e46872c12efdad181d11ae90bfe57e",
  "verdict": "APPROVE",
  "risk": "LOW",
  "blocking_findings": [],
  "non_blocking_notes": [
    "Zero-finding reviews create a trailing-pipe audit entry in unresolved_findings; this is a semantic wart, not an action-control defect.",
    "complete_review_cycle return values are validation-only and are currently discarded.",
    "The O_NOFOLLOW zero fallback is unreachable after its availability guard."
  ],
  "tests_missing": [
    "Successful repair followed by successful second review/checkpoint is not directly tested.",
    "The validate callback false-return branch is not directly tested.",
    "CRITICAL FINDINGS severity is not directly tested alongside HIGH.",
    "An intermediate ancestor symlink in persist_stop_decision is not directly tested."
  ],
  "reasoning_summary": "The supplied exact-commit continuation, review-handoff, stop-condition, and test evidence is narrow and preserves deterministic stop ordering, exact-SHA binding, immutable review-cycle evidence, atomic no-follow checkpoint/stop-record writes, and DRY_RUN isolation. No blocking issue was found. The listed tests are coverage gaps, not identified safety regressions.",
  "proposed_rules": []
}
